sentence1,sentence2,label
"After Mr Sorbellowas taken to hospital for a check-up, he was later discharged.","Mr Sorbello was brought to hospital for a check-up and then released, while Mr Pennisi believes he may have cracked ribs.",0
"Four Kuwaitis and six Palestinians with Jordan passports wereamong the suspects, the official said.","They include two Kuwaitis and six Palestinians with Jordanian passport, while the remainder are Iraqi andSaudi, the official said.",0
Bruce Lyman and Hal Varian of Berkeley'sSchool of InformationManagement and Systems say that information production has risen by thirty percent eachyearBetween September and has more,"That task appealed to two master of the megabyte, Peter Lyman and Hal Varian, professor at the University of Cal-Berkeley's school of Information Management and systems.",0
"Looking out the curve, the benchmark ten-year note US10YT XRR shed five up in price, taking its yield to three.26 percent from three.17 percent.","On Wednesday, the benchmark ten-year US10YT:RR had lost sixteen�'t in price, pushing its yields upwards to three.33 percent from three.26 percent late Tuesday.",0
Peaklee spokeswoman Jennifer Thompson said the company is continuing to work with authorities.,Shaklee spokeswomanJenifer Thompson referred all calls to the FBI.,0
Encluding legal costs and other charges it expected a profit of between one and four cents a share.,"Including litigation charges it had a profit of dollar seven.8 million, or ten cents a share.",0
Romanian ports authorities said two ship that sunk inWorld War II had resurfaced as water levels fall and can block river traffic.,Local authorities in Romania said two ship that disappeared duringWorld War II but resurfaced due to low water levels couldblock river traffic.,1
"Eugene Uhl joined his father and grandfather in the military, his mother said.",She said my son follow his dad and grandfather into the military.,1
"In Europe, France's cAC-40 dropped zero.8 percent, Britain's fTSE cap shed zero.9 percent and German's DAX index gave back one percent.","In midday trading in Europe, France'sCAC-40 fell one.6 percent,Britain's FTSE cap dropped one.2 percent andGermany's DAX index lost one.9 percent.",1
"shares of EDS advanced dollar one.49, or six.6 percent, to dollar twenty.999 late Wednesday on the New York Stock Exchange.","shares were off thirty cents, or one.3 percent, at dollar."".58 on Tuesday on the New York Stock Exchange.",0
chief Executive Rod Eddington is to meet the three unions separately on Monday evening.,Eddington is to meet the other two unions independently later on Monday.,1
The Mariners torched Randy Choate and Juan Acevedo in the eight for four runs and a twelve-5 bulge.,The Mariners piled on against Randy Choate and Juan Acevedo in the bottom of that inning.,0
She was persuade not to resign but she was anticipated to be the target of a forthcoming ministerial reshuffle.,But she was expect to be a victim in a forthcoming ministerreshuffle.,0
He hasa preliminary hearing ThursdayTo determine whether she'll stand trial.,The question is if there Will be a hearingto determine if Bryant will stand trial.,0
"Carrado's aunt thinks her nephew,whohas served a jail sentence in Cuba,will be persecutedif he is repatriated.","Maria Parrado believes her nephew,who served a twelve-year prison sentence in Cuba afterbeing arrested in Cuban waters,will be persecuted if he is sentback there.",1
"Almost immediately said his agency will appealing the decision, but many others following the case said an appeal seemed likely soon.",Neither said if they would appeal the ruling but others said an appeal is certain.,1
"However, researchers headed by physicist Frank McDonald of theUniversity of Maryland disagrees.","It's just a matter of Time, said Frank McDonald,of theUniversity of Maryland.",0
"But the yen's losses were capped by wariness over Japanese intervention, with some traders reporting irregular bids that smack of intervention around the yen —","But the yen's losses were capped by wariness over Japanese intervention, with some traders reported irregular bids around the yen that may befrom the Bank of Japan.",1
He also said he plans to meet with scientist and Legal experts but will not make a determination on the bill for a few more weeks.,He said he intends to meet with scientist and law specialists and will not decide the legislation's fate for another few more Weeks.,1
"""I feel that people that are writing these messages are infringement on my rights and everybody else's right to use their computers,"" said McKechnie.","The people who are sending these Messages are infringingon my rightsand anyone else's rights to use your computer, other McKechnie said.",1
"He said there is no question Waagner is behind the letters,which were sentat the same time of the anthrax attacks.","He added there is No question Waagner is behind the letters,which were sentatthe same time that real anthrax attacks were killingpeople in) our",1
"Florida's primary aren't until March September, following eight other states ""","Georgia's primary will beMarch nine, after seven states' primaries or caucuses.",1
Former chief financial officer Franklyn M. Bergonzi pled guilty to one charge of conspiracy on June Monday and agreed to cooperate with prosecutors.,"Last week, former Chief Financial Officer Franklyn Bergonzi plead guilty to one count of conspiracy and agreed to cooperating with the government's investigate there",1
"Three partners in Grant Thornton's Italy business were arrested last week and questioned by magistrates exploring the collapse of Parmalat, the Italy dairy company.",Four partners in Grant Thornton's Italian business have been arrestedandare being questioned by Magistrates over the collapse of the giant food group.,1
Wells Fargo and quicken Loans can't be reached for comment Wednesday afternoon.,"Wells Fargo was not available to comment, and a quicken Loans spokesman refused immediate comments.",0
"Under the NBC proposal, Vivendi would merge itsU.S. film and television business with NBC's broadcast network,Spanish-language network and cable channels including CNBC and Bravo.","Under a deal withGeneral Electric's NBC, Vivendi's film and television businesswould merge with NBC's broadcast network, Spanish-language network and cable channels including CNBCand Bravo.",1
Sterling was down zero.8 percent against the dollar at dollar one.5875GBP more was,The dollar advanced zero.15 percent against the Japanese currency to rm.97 yen.,0
"In terms of a free trade area, we've got a long, long way to go and the Pakistanis understand that.","As for a free trade area, the official stressed that weve got a Long, Long way to Go, and the Pakistanis understand that.",1
"Responding later, Edward Skyler, a spokeswoman for the mayor, said,"" The comptroller's statement, although noteworthy for its sensationalism, bore zero relation to the facts.","Josh Barowitz, a spokeswoman for Republican Mayor Michael Bloomberg said:"" The Comptroller's statement, while notable for their sensationalism, bearing zero relation to the facts. but",0
The Dow Jones Industrial Average gained for the four weeks in a Row.,"The Dow Jones industrial average.DJI increased naked.61 points, or zero.44 percent, to nine,415.82.",0
Mississippi placed within the bottom ten states in thirteen of the seventeen measures.,Mississippi is within the bottom five states on nine other metrics.,1
"Today, the worldwide Death toll reached after with More than eight,300 people sickened since the severe acute respiratory syndrome virus first arrived in southern China in November.","The worldwide death toll from SARS was at least seven67, with More nearly eight,300 people sickened since the viruses first appears in south China in Nov.",1
"But Davis advisor Roger Salazar said the governor's focus is on his job, not the recall petition.","But Davis advisor Roger Salazar said the governor's focus""is on doing thework that he'sbeing paid to do. has",0
"Dotson, meanwhile, conceded to FBI agents that he killed Dennehy in the head"" because Patrick had attempted to kill him, which according to an arrest warrant released yesterday.","according to a arrest warrant released Tuesday, Dotson confessed to FBI Agents that he shot Dennehy in the skull"" because Patrick had wanted to shot him. after",1
"In early morning trading, the Dow was up thirteen.88, or zero.2 percent, at nine,002.93, having lost two.3 percent last week.","In Early trading, the Dow Jones Industrial Average was down nine.94, or zero.4 percent, at eight,945.50, having declined three.61 points Monday.",0
""" His words are incredibly appropriate and the decision was an easier one, t MSNBC spokesman Jeremy Gaines said.",""" Savage made an extraordinarily offensive comment and the decision to cancel the program was not easy, s MSNBC spokesman Jeremy Gaines said.",1
"Allied forces have overthrown the government, moved into Saddam Hussein's Palaces and started to patrol the streets of the capital.","Allied forces have defeat Saddam's military, moved into his palaces and starting to patrol Baghdad.",1
We are currently attempting to understand the scope and detail of the investigation. � more it,Weber said late Thursday that the company is still trying to explain the scope and details of the investigation.,1
"The tech-laced Nasdaq Composite Index.IXIC dropped two points, or zero.18 percent, to one,649.","The tech-laced Nasdaq Composite Index.IXIC was down a mere zero.04 of a point at one,653.",0
Shares in the big mortgages lenders also declined to record lows.,Shares of other mortgage sellersand home construction companiesalso fell.,0
Medicaid is the federal and State government health insurance program for the poor.,"Medicaid, which received federal and state financing,is the government health-insurance programforthe poor.",1
"The operating revenues were dollar one.45 billion, an improvement over last year's result of dollar one.38 billion.",Operating revenues increased to dollar one.45 billion from dollar one.38 billion last year the,1
"""The timing of[ the miniseries]isabsolutely staggeringto me,"" Nancy Reagansaid in a statement to Fox News Channellast been have","Nancy Reagan released a Statement last week to the FoxNews Channel saying,"" The timing of[ the miniseries] is absolutely staggering to me.",1
"The sealwill eventually be usedto identify DHS badges, vehicles, signs, sea vessel and aircraft.","The seal will eventually be used on department materials, signage, credentials, badges, vehicles, sea vessel and aircraft.",1
"The high Saturday is expected to be about ninety degrees, and it Will probably fall to ninety degreesSunday and Monday would",The high today will be about ninety degree and will fall to ninety degrees Sunday and Monday.,1
The house and senate are expected to vote on the omnibus bill within the coming two months.,The House Republican leadership said it expected to called lawmakers back December. eight for another vote on the omnibus bill.,0
"In morning trading on TheNewYorkStock Exchange, Coca-Cola stock were down four cents at a this.67 In","Coca-Cola's shares were steady in late morning trade in New York, down just thirteen cents to dollar.88.",1
and NASCAR officials refused to comment.,CAR officialscould not be reached for comment Tuesday.,0
Herry last month outlined aU.N. resolution approving a military force under U.S. command and transfer responsibility to the United Nations for the politics and humanitarian initiatives.,Werry outlined last month a UN resolution authorizing a military force under US command and transferring responsibilities for politics and humanitarian initiatives to the UN.,1
""" It is a benign web where we hope to catch fire and whereeach of us can advancing our enlightened self interest by cooperate with others. is","It is a benign web where we hope to catch investors and where Each of us can advanced our enlightened Self-interest through collaboration with others,' said Mr Goh.",1
Their father had appealed with the doctors to stop the fight after his wife's euthanasia bid left their son in a coma and his was put onto Life-support.,Their father had pleading with doctors to abandon their efforst after his wife's euthanasia bid left their son in a coma and she was placed on life support.,1
It also contracted Citigroup and Morgan Stanley to study refinancing or restructuring of dollar been million in senior bonds due next year.,Ta also has selected Citigroup and Morgan Stanley to evaluate options for refinancing or restructuring dollar would million of ten.5 percent senior bonds due in August but,1
"Kerr,who wonthree titles with the Chicago Bulls in the ninety'sand onewith the Spurs in: he finished with two points, three assists and two rebounds.","Kerr,who won fourNBA championships with Chicago and one with the Spurs in September, completed with six points, three assists and two rebounds.",1
TheU.N. office of the humanitarian Coordinator forIraq last weekreported that cases of diarrheahave doubled in Baghdad.,People gets sick from drinking the water: TheUnited Nations Office of the Humanitarian coordinator forIraq last week reported that cases of diarrhea have tripled in Baghdad.,0
"This week's tour will take Bush to Senegal, South Africans, Botswana, Uganda and Nigeria, and is aiming at softerening his warrior image at home and internationally.","In his first visit to sub-Saharan African as president, Mr. Bushwill visit Senegal, South African, Botswana, Uganda and Nigeria before Returning Home On Saturday.",0
""" He really leave us with a smile on his Face and no final Words, s daughter Linda Hope said.",""" He truly left us with a grin on his face and no last Words. He gave us each a smile and that was it,"" she said.",0
"despite their disagreements, U.S. and EU leaders said there are area of agreement.","Despite this and other inconsistencies,U.S. and EU leaders insisted they wereworking well together.",1
"The broader Standard and Poor's Stock index.SPX sank nine.90 Points, or zero.99 percent, to nine88.61.","The tech-laced Nasdaq Composite Index was down Monday.36 Points, or one.53 percent, at one,628.26.",0
"Those involved were alleged told to not talk of the incident again, prior to the shooting.",The letter said staff was advised to NEVER speak of the incident.,1
"Carlton Dotson, a teammate who lives in Hurlock, Md. He said he talk to police Friday but was instructed not to speak about the case.","Payton Dotson,who was on the team last season and resides in Hurlock, Md. He said he was ordered not to speakabout the case.",1
She said the store bought It year and reserved another A In,"In one Johannesburg store, and copies have been ordered.",0
He also claimed he warned his grow-up children not to run up credit cards debts.,Barclays chief executive Matt Barrett also claimed he had instructed his children not too use credit cards.,1
"The woman, Mary Kathryn Miller, pictured,was arrestedby the state police onNov. about and charged with First-degreeLarceny.","Susan Kathryn Miller, pictured, of Southeast Devon Road, Darien,was arrested Nov. Tuesdayby state Policeand charged withfirst-degree larceny.",1
"The top speed of Ethernet could hit fortyG bps( bits per second) within the Next two year, a senior Cisco SystemsInc. executive said Wednesday.","The top speed of Ethernet should hit fortyG bit per sec during the next two years,a senior Cisco execsaid Wednesday.",1
"The riotersshot one man in the shoulder and beat or stabbed others, police said.",On Tuesday night Riotersshot one person in the shoulder and beatingor stabbed others.,1
""" Germany is on the correct path,"" Ms. Schroder said, specifying his government's announced structural reform plans, known as Agenda Bahrain, and changes in taxes.",""" Germany is on the right path,"" he said, specifying his government's announced structural reforms plan, Known as Agenda Obama,and tax cuts.",1
""" It's a huge black eye,"" said publisher Arthur Ochs Sulzberger Jr.,whose family has controlled the paper since slavery.",""" It's a huge black eye, "" Arthur Sulzberger, the newspaper's publisher, said of the scandal.",0
The awards are being announcement today by the Albert and MaryLasker Foundation.,"The prizes,from the Albert andMaryLasker Foundation, will be awarded Friday inNew York.",1
Officials said they will conduct DNA testing to confirm the man's identification.,tests will be conducted to confirm his identification.,1
The rebels suspended peace negotiationswith the government April Wednesday cited a lack ofprogress.,The Liberation Tigers of Tamil eelam halted peace talks April Wednesday citing a lack of progress.,1
"The twenty master computers are located in theUnited States, Canada and Korea, Ms. Kuo said.","The computerswere located in the United States, CanadaandSouth Korea, he said.",1
Gunfire could be heard in the background as Ghafar spoken by satellite telephone.,"As he spoken by satellite phone, shellfire could be heard in thebackground.",1
Stock of Coke were Up six cents at dollar's.42 in morning trading Wednesday on theNew York Stock Exchange.,Officers of Coke were down six cents to close at dollars.10 on the New York Stock Exchange.,0
"Analysts had expected three cents a share, According to researcher firm Thomson First Call.","Home Depot is projected to report profits per share of six cents for the third quarter, according to Thomson First Call.",0
"This meansBerlusconiwill be safe from prosecution Until he exits elected office, scheduled fors,","This means Berlusconi will remain safe from prosecution until his term closes in June, unless his government fell before then.",0
The veteran Malyasian diplomat metSuu Kyi Wednesdayat the Lakeside home in Yangon where she isunder house arrest.,"Fazali Ismail met for ninety minutes with Suu Kyi, a former winner of the Nobel Peace Prize, in her lakeside home, where she is Under house arrest.",0
"For the full twelve-month period ending June thirty, advanced services lines of all technology types increased by six percent.","For the full yearperiod ending June thirty, "" time high-speed lines increased by or percent.",1
The transaction will grant handspring Stockholders zero.09 of one share of Palm--and no share of PalmSource--for every share of Handspring Common stock.,"Under the proposed termsof the transaction, and following the spinoff of PalmSource, Palm will exchange zero.09 shares for every share of Handspring.",0
A shares were down dollars one.85 at dollar eight.07 on the Nasdaq Stock Market in Tuesday midday trading.,"A shares ended down dollars one.66, or sixteen.7 percent, at dollar eight.26 on the Nasdaq Stock Market.",1
""" It's hard to believe that we live in a society where parents wouldn't be notified of an abortion, which is a really profoundly decision. had",""" it's tough to imagine we living in a society where parents shouldn shet be notified of an Abortion, Tester said.",0
"And tonight, seven-year-old Morgan and as much as one,200 fellow student at Wheaton College will gather in the gym for the first real dance in the School's three-year history.","As Many as one,200 students at Wheaton College will gather in the gymFriday evening for the first real dance in the Christian school's three-year history.",1
The board is investigate whether a scarcity of funds in the shuttle program compromised safety.,The board is researching whether this compromised safety on the shuttle.,1
"Eyewitnesses knew how Sally, below, originally from Coatbridge, Lanarkshire, gasped as the escalator collapsed and sucked her in.","Dad-of-two Sally, formerly from Coatbridge, Lanarkshire, had step on to the escalator when it collapsed.",0
Hoy confirmed the woman's age Tuesday but said she has left on holiday with her family.,"Hoyconfirmed the women's age Tuesday and said she is on holiday with her family, and is expecting to return this week.",0
"Company spokesman Jerry Cheske said price may have impacted some plans, but cheap hotel deals mitigated the effects.","Company spokesman Jerry Cheske said prices might have affected some plans, but cheap hotel deals made up for it.",1
Police official S.K. Tonapi told Reuters at least forty people had been dead and More than hundred wounded.,State interior ministry spokesman Vasant Pitke told Reuters that At least forty people have been killed and six injured.,0
"The teenager was in surgery at Sacred Heart Hospital Center, and the extent of his injuries is not available, Bragdon said.","The teenager is in critical condition at Sacred heart Medical center, police said in a press release.",0
President Wesley Clark finally verified this week that he will seek the Democrat nomination to run against President George Bush in next year's presidential elections.,Retired general Wesley Clark's entrance onto the race for the Democratic presidential nomination will most certainly strengthen anti-war forces determined to unseat US presidentGeorge W Bush next year.,0
Company spokesman Steve Lazarus did not immediately return a phone call for comments on Friday.,Cable and Carter's TradingCo. did not immediately return calls requesting comment on Wednesday.,0
""" If I were diagnosed today with CJD, I would ensure I received this treatment as quickly as humanly practicable.","He added that If he were diagnosed with vCJD"" I would ensure I obtained this treatment as soon as humanly possible""t",1
"This deterioration of security compounds when Nearly all PCs rely on a single operating system subjected to the same vulnerabilities the world over, last Geer added.",""" The deterioration of security compounds when almost all PCs rely upon a single operating system subjected to the same vulnerabilities the world over. people",1
"French giant Vivendi Universal EAUG.PA V.N set to work sifting through bid for its U.S. entertainment empire on Monday in amultibillion-dollar auction of some of Hollywood's well-known assets.""",Movie moguls Jostled for position as the deadline for bids for Vivendi Universal'sU.S. entertainment empire Neared On Monday in an auction of some of Hollywood'sbest-known assets its,1
"At First blush, then, the distinction drawing by the designers of the do-not-call registry would appear to draw the line in exactly the right place.","At second blush, then, the creators of the registry would appear to have drew the line between permitted and banned calls in the right place.",1
A statement provided by DEI said Green would begin driving the car on an interim basis beginning Next week in the Winston Open at Lowe's Motor Speedway.,"It was announced that Green would replaced Park in the Dale Earnhardt Inc. No. One Chevrolet, beginning with the Winston Open At Lowe's Motor Speedway Next week.",1
A huge jump in Consumer confidence has provided the only positive economy news in recently weeks.,But a huge peak in consumers confidence has interrupted the bleak economic news.,1
The transaction will expand the revenue from Callebaut's consumers products business to forty percent of total sales from twenty percent I,The transaction will increase Callebaut's sales revenues from its consumer products business to forty percent from twenty percent.,1
"The two forms account for almost three percent of the approximately seven million immigration benefits applications received annually, immigration authorities said.",The two forms comprise three percent of the seven million applications filed to the bureau each year.,1
"also Paul already has three children fashion designer Stella, its, Mary,, and James, all by his wife Linda, who die from breast cancer in Kent.","Cartney has three children-fashion designer Stella,t, Mary, three, and James, five, by first wife Linda.",0
"Farmland Foods President George Richter said,"" With Smithfield's support and leadership, Farmland Foods Will succeed and continue to sustain the Midwestern Communities which depend upon it. are","With Smithfields leadership, Farmland Foods will success and continue to sustain the Midwestern Communities which depend on it.",1
"Tyler Kasmer, a fourteen-year-old form Belmont, n.C., got a word that tasted like"" zistee"" during yesterday's competition.","The fourteen-year-old national spellingfinalist who attended school in Belmont,N.C. that got a word that sounded like"" zistee"" during competition Wednesday.",1
"Although Ms. Qurei is universally respected and has a lengthy history of negotiating with the Israelis, he cannot expect sucha warm welcome.","While Qureia is respected and has a past of working with the Israelis, a warm welcome is not expected.",1
"David Durousseau, thirty, was charge Tuesday with murder in five slayings between January andFebruary, and also is accused of a prior killing in the state of Georgia.","Robert Durousseau, too, was charged Tuesday with murder in five Jacksonville slayings between December and Feb, and in a bloody Georgia killing.",1
"The indict supercedes a criminal complaint filed against Quattrone on April, with similar accusations.",The indictment follows a criminal complaint released by federal prosecutors on April Thursday.,0
"Hormone replacement therapy that combine estrogen with progestin doubles a woman's risk for breast cancer, a Britain study of More than a million women has revealed.","A major British study has add to the evidence that hormone replacement Therapy improves the risk of breast cancer, particularly when women receive a combo of estrogen and progestin.",1
Civilian reservists also can be dispatched abroad for jobs such as the rebuilding of Afghan and Iraq.,"Iranian Reservists also might be dispatched offshore for jobs such as reconstruction in Afghan and Iraq, working in roles from translator to truck Driver.",0
"About eight percent of men giving finasteride developed prostate cancer, compared with six percent on placebo.","They discovered that six.4 percent of men on finasteride had High-grade tumors, comparing with five.1 percent taking a placebo.",1
