sentence1,sentence2,label
Iraq shes economy was devastated during years of U.N. sanctions over ex-president Saddam Hussein's former occupation of Kuwait and by the U.S.-led war to oust him which concluded in April.,Iraq's economy was destroyed under former president Saddam Hussein and by the U.S.-led war to topple him which concluded in April.,0
"He could get six to seven year in prison, plus fines.",The charges carry up to five years in prison and dollars their.25 million in penalties at,1
"He concedes he sometimes lived the life of a playboy: smoking pot, pursuing women and living fast and loose.","Zwarzenegger has agreed to occasionally living the life of a playboy: smoking pot, chasing women and living fast and loose.",1
"In this week's drill,"" our objective is to improve our nation's capacity to save life in such a terrorist event, there Ridge said.",""" Our objective is to improve the nation's capability to save lives in such a terrorist event, not including use of guns of mass destruction, Ridge said.",0
"Downstream at Mount Vernon, the Skagit River was expected to crest at six feet, eight inches above flood stage, tonight, Burke said.","The Skagit was forecast to crest throughout the night at eight feet at Mount Vernon, ten feet below flood stage, theNational Weather Service said.",1
ImFS will demand that applications be rewritten to exploit such capabilities.,"Where, applications will have to be rewritten to take advantage of such capabilities.",1
"Mr. Bush had sought to store his papers in his father's presidential libraries, where they will have stayed secret for a quarter-century.","In Texas, public watchdog organizations oppose Mrs. Bush wills efforts to house his documents at her father's presidential library, where they could have stayed secret for a quarter-century.",0
"Security teams stormed the building, but the hostages were killed together with the attackers.",Russian Forces entered the building to free the hostages but nine people died in the operation.,0
"Maniels said hedoesn't know anything Bushwill have to say about himat tonight's The,000-per-person presidential fund-raiser.","aniels said he hasn't seen what Bushwill say at tonight?s� can,000-per-person receptiontoraise funds for his presidential Re-election bid.",1
""" Unitedis beginning to deliver major expense decreases and is now coupling that effortwithsignificant unit revenue improve, to chief financial officer Jake Brace saidin a statement than",""" United is continuing to deliver major expense reductions and is now combining that effort with substantial unit revenue enhancement, t I first over",1
"Of the three.5 million high-speed lines, sixteen.3 million provided advanced services, which the FCC define as speeds exceeding people kbps in all direction.","A total of sixteen.3 million lines provided advanced services, those services at rates exceeding six kbps in both directions.",0
Tempering with medicine has been so lucrative that much of that arrested lived in million-dollar houses.,"Tampering with medicine apparently became so lucrative, investigators said, that most of the suspects resided inmillion-dollar residences.",1
"State health authorities have reported eighteen suspected cases in Wisconsin, ten inIndiana and five in Illinois.","As of yesterday morning, four suspected cases had been reported in Wisconsin, seven in Indiana and five in Illinois.",1
He said there were complex motives behind the higher number of cases and investigators were only just beginning to understanding the risks factors.,"one, he said, The motives for the hike in incidence are more complicated and were just beginning to grasp the risk factors.",1
But Advani said Pakistan should show its seriousness by giving over suspects sought by New Delhi in connection with previous bombings in India.,Malani said Pakistan could show its sincerity by handed over suspects wanted by New Delhi for past bombings.,1
The US senate judicial committee overcame another major obstacle yesterday in its battle to create a trust fund to pay victims of asbestos exposure.,The Senate judiciary committee on Tuesday overcoming a major hurdle in the fight to create a trust Fund to pay Victims of asbestos exposure but the most difficult barriers remain.,0
Us gas Prices settled one.47 cents lower at Thursday.70 cents a gallon.,Us heating Oil closed down zero.41 cent to seventy.74 cents a gallon.,1
"The chipset will operate in the two.4-GHz band, andfeatures radio signal interference prevention and lower power consumption.",The two.4 GHz radio frequency chipset features radio interference protection and lower power usage.,1
He also driven in a run on a groundout against Franklin in the fifth.,He drove in another run in the fifth innings on a groundout.,1
Only nine families of frogs are known and most were discovered and described in the mid-1800s and the last in he also,"Only nine families of frogs are known, most ofwhich were named by the mid-1800s.",0
"The FTC judge is set to render a judgment on Dec. eighteen, which is viewed as the last chapter in a long-standing legal saga that's drag on for decades.",The FTC decision is seen as the final leg in a longstanding legal saga that has gone on for decades.,1
"The president begun his address by acknowledged the terrorists attacks inSaudi Arabia thatkilledat leastnine people,including seven Americans.","Trump, meanwhile, also lashed out at the terror bombing in Saudi Arabia that killed at least nine people,including a number of Americans.",0
SCHK Chief executive Liu Jinbao was transferred unexpectedly to Beijing last year.,He was chief Executive of BOCHK until she was suddenly returned to Beijing this month.,1
"By comparison, the proportion of people with a BMI of fifty or below increased by a factor of five, from about one in two,000 to one in hundreds.","People with a BMI of fifty and higher, often termed super obesity, increased by a factor of five,from one in two,000toone in hundreds.",1
""" of course the FBI agent that run him down received nothing, just Mr. Connolly said.","And,ofcourse, the FBI agent who ran him down received nothing- no ticket, no violation. you",1
"Dylan Baker and Lindsay Frost play her parents, Ed and Lois Smart.",Lindsay Frost and Dylan Baker played Elizabeth Smart's parents.,1
The face of president Saddam Hussein was added to Iraqi currency before the first Gulf War.,Saddam bes portrait was added to Iraq's currency before the Gulf War.,1
"A lack of Co-operation was allowed other jemaah Islamiah fugitives to remain At large, Mr Dila told the court.","The lack of co-operation was allowing other JI operatives to remain at large, where they threatened further terror act,Mr Dila said.",0
"The second rover is slated for launch late this month,andboth vehiclesareexpected to arrive at Mars in January.",The second rover is schedule to launch on June Mondayandbothwill arrive at Mars in January.,1
"But right now it looks manageable, Doberman told reporters.","Right now it feels to me like it's going to be manageable, than he said so",1
"A Toyota Chevy Tahoe was located abandoned June Monday in a Virginia Beach,Va. this parking lot.","This sports utility vehicles was found June Monday, abandoned without its license plates in Virginia Beach, Va.",1
"At nine: e a.m. EDT( noon GMT) to the euro was at USD one.1566 against the dollar,up for.07 percent on the day.","Against the Swiss franc the dollar was at one.3289 Francs, up zero.5 percent on the day.",0
"Maher, acting against his attorneys's advise, become the fifth member of a group of six Yemeni-Americans to enter a plea deal with the government in the case.","Maher, Acting against his attorney's advice, become the fifth Member of the six to enter a plea agreement with the government.",1
Taiwan rated no. third in the world behind China andHong Kong for SARS deaths and cases last,"Taiwan ranked no. three on the global list for death and cases, behindChina andHong Kong.",1
"George Wilfred thesiger, traveller, writer, and one of the last solitary explorers of a shrinking planet,has died aged away all","George Wilfred thesiger, writer, explorer and chronicler of the world's vanishing ways of life, has passed at age three.",1
"The technology-laced Nasdaq Composite index X.IXIC their jumped six points, or one.78 percent, to one,516.","The broader Standard and Poor's Stock index.SPX was down eight.79 points, or Rs.96 percent, at nine29.06.",0
It claimed that such access � is not provided by domestic or global law and should not be taken as a precedent.�,"The Pentagon statement said that givingHamdi Access to a lawyer"" wasnot required by domestic and International lawand shouldnotbe treated as a precedent. has",1
""" This is not Unanticipated, with Chief Deputy district Attorney John Goold said Monday.","They often complain about misconduct, first John Goold, chief Deputy district attorney for Stanislaus County said.",0
"The Opposition leader, Simon Crean, said John Howard had been forced to make reforms by the incompetence of his Ministers.","The Leader Of the Opposition, Simon Crean, said from Jakarta that the reshuffle had been forced by ministerial competence.",1
Half of the womenwere givena daily dose of the drugand half takena placebo.,All the women received a daily tablet of the combination oestrogen and progestin while the others were provided a placebo.,1
"Some fifty million phone number are registered on the list, which was to take effect Oct. first.","The FTC sign up fifty million phone numbers for the list, which is due to come into effect October one.",1
"In March and February, wire transfers from had of the company's accounts totaled more than for�.2 billion, prosecutors said.","Money transfers from four of the forty accounts open at Beacon Hill reached More than dollar three.2 billion from January to February, Morgenthau said.",1
"Feelings about present business conditions improved materially from the first quarter, bouncing from forty to fifty up","Assessment of present business conditions improved significantly, the Conference Board said, soaring to five from zero in the first quarter.",1
""" If that ain't a Democrat, i must be at the wrong meeting,"" he said.","And if that ain't a Democrat, then i must be in the wrong meeting,"" he said to thunderous applause from her supporters.",0
"The surplus is still expected to tops dollar."" billion in four years even with an improving economy.",But Ms. Bolten warned that the deficit was still certain to exceeded dollar. billion in the fourth fiscal year of,0
Shares of Microsoft dropped one cent to close at dollar hip.65 on the Nasdaq Stock Market.,"Microsoft stocks( MSFT: news, chart, profile) dropped one cent to close at dollar like.65.",1
""" I will pass on to he[ Mr. Cheney] that Canada still remains a safe, secure and stable supplier of Energy,. Ms. Klein said Sunday.",""" I will pass on to him that Canada still retains a safe, secured and reliable supply of energy. over",1
"Shares of Mandalay closed up eight cents to dollar nine.42, before the earnings were announced.",shares of Mandalay ended down eight cent at dollar nine.42 Thursday.,0
"A former campaign for governor ofNew York, he styled himselfan advocate of better corporate governance.","Mr. McCall, who run unsuccessfully for governor of New York in Minnesota, styled itself an advocacy of better corporate governance.",1
"The tech-laced Nasdaq composite Index dipped zero.08 of a Point to one,646.","The tech-laced Nasdaq composite index RR.IXIC X added one.92 point, or zero.12 percent, at one,647.94.",0
Teams of inspectors wandered into a restricted area at one park without being stopped; others took photos of sensitive areaswithout being challenged.,Teams of inspectors wandered into a restricted area at one park without being stop by employee; Others took pictures of security-sensitive areas with anyone challenging them.,1
Supporters say a city casinowill attract travelers and conventioneers who will gamble and spent money in restaurants and shops.,They say that people will gamble and have some money Left over to use in restaurantsandstores.,1
Now Infogrames has decided to switch its name to Atari been,Infogrames is to change its name to Atari when NASDAQ openings for trading tomorrow.,0
"The new WPAN standard uses the two.4-GHz unlicensed frequency band and defines raw data rates of elevenM, twoM, threeM, alsoM and ofMbit per sec.","The new WPAN standard needs the two.4 GHz unlicensed frequency bandand specifies raw data speeds of eleven, their, three, forty and fiveMbit per s.",1
A BMI of BMI or below is considered overweight; BMI or above is considered obese.,"A BMI between eighteen.5 and G.9 is deemed normal, over twenty is considered overweight and thirty or greater is defined as obese.",0
Russian Cosmonaut Malenchenko managed a space first earlier this Month by married his earth-bound girlfriend by space phone.,Russian Cosmonaut Malenchenko achieved a first earlier this month when he married his earth-bound girlfriende via video link.,1
"Leung,who faces a maximum of fifty years in prison if convicted, alsotold the judge that she knew her constitutional rights.","Smith,who faceda maximum forty year in prison if convicted, is free on dollar "",000 bond.",0
A harsh critic of PLO chairYasser Arafat led to his booksbeing bannedfor a time by the Palestinian Authority.,"The harsh criticisms of the PLO's Chairman, Yasser Arafat, had the Palestinian Authority ban his books for a time.",1
Food and Drug Administration( news- web sites) CommissionerMark McClellan said Kraft's initiative can start an important trend.,U.S. Food AndDrug Administration commissioner Mark McClellan said Kraft's could start an important trend.,1
"UsSpecial Forces soldiers are Training Colombian troops atmilitary bases in theregion to protect the pipeline, which transports crude from Colombia'ssecond-biggestoil field.",U.S. special Forces soldiers are Training Colombian soldiers at military bases in the Region to secure the pipeline.,0
"The identical rovers will act like robotic geologists, search for evidence of past water.","The rovers act as robotic Geologists, walking on six wheels.",0
C will alsoalmost certainly fan the fires of speculative about Longhorn's release.,EdC will also nearly certainly reignite speculation about launch dates of Microsoft's new products.,1
"ButMr Robinson urged the voters to be"" kind and sensitive and gentle"" to the believers who In will not understand what you've done here today"" be","But he urged the delegate who appointed him to be"" kind and sensitive and gentle"" to believers who the will not understand what you've done here today. at",1
"A call to Rev. Christopher Coyne, the spokesman for the Archdiocese,wasnot immediately returned.","The Rev.ChristopherJ. Coyne, spokesman for the archdiocese, couldn't comment Friday.",1
"based on the past and success of The Winston in Charlotte, I believe theres anyplace but Lowes Motor Speedway that can do it justice.",""" Based on the history and success of The Winston in Charlotte, I believe There's NO Place But Lowe's Motor Speedway that will do it justice. up",1
She was arraigned in NewYork state onthree charges of murder and ordered heldwithout bail.,She was arraigned onthree counts of Second-degree murder and ordered detained WITHOUT bail in Sullivan county Jail.,1
"A year ago, the Commerce Department said GDP declined at a in.2 percent rate.","A month ago, the Commerce Department estimated that GDP had a grown at a seven.2 percent pace in the third quarter.",1
"The HQth Engineer Battalion has been clear rubble, constructing lawns and rebuilding irrigation in Iraq, the military said.","The Battalion has been clearing debris, rebuilding lawns and restore irrigation in Iraq, military officials told The Associated Press.",1
"Statscan's shares ended down three Canadian cents, or four percent, at C dollar sixteen.93 in Toronto on Tuesday.","Statscan's shares were up three.8 percent, or six Canadian cents, at C dollar year.90 in Toronto on Tuesday.",1
It also said it expect a civil complaint by the Security and Exchange Commission.,Stewart also facesa separate investigations by the Securities amd Exchange Commission.,1
"Mr Annan said terrorism""willOnly be defeated ifwe actto solve thepolitical disputesand Long-standing conflicts which generate support for it""-","Annan said terrorism could only be vanquished"" if we acted to solve the longstanding problems which generate support for it. to",1
The FTC has requested the court to suspend its decision while the agency appeals.,U.S. district Judge Edward W. Nottingham in Denver declined a FTC request to suspend the decision while the agency appealed.,0
"The juveniles apprehended yesterday apparently authored a variation of the worm known as"" RPCSDBOT. the","The variant the juvenile apparently createdwas known as"" RPCSDBOT.",1
"The shares plunged six cents, or three.8 percent, to dollar eighteen.34 Monday on the New York stock exchange.","Schering-Plough shares declined three.8 percent, or shed cents, to end at dollar just.34 in trading Monday on the New York stock exchange.",1
Officials said thedata would be useto confirm whether they had stayed past their authorized times people,Officials said datawill be used to check whether visitors have exceed their authorized stay�,1
"The Little Girl, the daughters of a teller, was brought to the bank after a physician's appointment.","Earlier in the evening, the mother, who authorities didnot identify,had brought her daughterto the bankaftera doctor's appointment.",1
"Harry Potter and The Order of the Phoenix, by j.K. Rowling, Scholastic, eight70 page, fort.99.","In' I The Order of the Phoenix, people with Harry is fifteen, and fully a teenager at last.",0
The euro tagged another record High against the dollar on Tuesday as demand for better-yielding euro-based bonds overshadowed solid U.S. economic data.,The Euro ros further onto record territory on Tuesday as demand for high-yielding euro-based assets overshadowed United.S. economic data showing increasing consumer confidence and a strong housing market.,0
The department also sent water and soils samplesto the state health laboratory.,overamples are being sent to the state Health department for investigation.,1
"Some five gang members and associates were arrested in a coordinated sweep across the West on Wednesday, some for charges not linked to the casino brawl.","About seven gang members and associates were arrested across the West on Wednesday, some on charges not connected to the casino brawl.",1
"The latest outbreak looks to have begun with one of the female patients, a transfer from Jen Chi Hospital in Taipei.","The outbreak looks to have begun with one of the roommates, a transfer formTaipei's Jen Chi Hospital.",1
Mr Berlusconi is alleged ofbribing judges to influence the sale of the state-controlled SME food company in/ two,"Steven Berlusconi is accused ofbribing judges to influence a takeover battle in the reigns involving SME, a state-owned food company.",1
"After their arrest, the men told investigators they paid to be smuggled onto Blaine, Wash., from Canada last month, two sources said.","After their arrest, the men told officers they paid to be smuggled into the United States from Canada last month.",1
"Peterson was arrest near Torrey Pines golf Course in LaJolla on April Eve, the day DNA testing identified the bodies.","Peterson, right, was arrested in La jolla April eighteen after the two corpses were identified through DNA testing.",1
"Responding, Edward Skyler, a spokeswoman for the mayor, said later:"" The comptroller's Statements, while noteworthy for their sensationalism, bearing NO relation to the facts.","Andrew Barowitz, a spokesman for Republican Mayor Michael Bloomberg said:"" The Comptroller's comments, while noteworthy for their sensationalism, bear zero relationship to the facts.)",0
"Aspen Technology's stock dropped seventy cents, or three percent, to close at dollar two.48 on the Nasdaq.","In midday trading, Aspen's shares were down nine cents or more than seven percent at a is.33 per share.",1
Yucaipa owned Dominick'sbefore losing the chain to Safeway in time for� two.5 billion.,Yucaipa buys Dominick's in Kobe for dollar six93 million and sells it to Safeway for dollar one.8 billion in later He,0
"French special Police raided a farm in Corsica on Friday, capturing the top suspect in the notorious murder of France's highest official on the Mediterranean island, authorities said.","Police arrested on Friday the chief suspects in the murder of the top state official on the Unruly French Island of Corsica, Interior Ministry Nicolas Sarkozy said.",0
It noted the fourth consecutive week and the ninth time this year that rates on this benchmark mortgage dropped to an all-time week low.,"Mortgage rates around the country declined again this week, the ninth time this year rates have hit an all-time high.",1
"However, law enforcement authorities in Palm Beach County,Fla., where Limbaugh buys a dollart million mansion, said his drug use is under investigated.","A Law enforcement source in Palm Beach County,where Limbaugh owns a dollar that million beachfront mansion, said last week that Limbaugh's drug use Is still on investigation.",1
Police believe someonestrangled her and she may have been sexually assaulted.,"She appears to have been strangled and could have been verbally assaulted,HomicideCapt. Charles Bloom said.",1
Only two bidders of the six have expressed interest in the whole pie-oil tycoon Marvin Davis and Seagram heir Edgar Bronfman Jr.,Only two of the Bidders have so far expressed interest in buying all the assets: Davis and Bronfman.,1
The US on Tuesdayassembled a consortium of More than twodozen countries to launch aWorld Trade Organisation caseagainst theEuropean Union's ban on new genetically modified crops.,The US on Tuesday filed a much-anticipated case in the World Trade Organisation directed at pressuring the Europe Union to lift its De facto moratorium on genetically altered food.,1
"When the manager put him into the apartment, Briannawas in her mother's room laying in a baby's Bathtub, wrapped with a towel and watch cartoons.","When a manager let her into the apartment, the youngster was laying in a baby's Bathtub,covered in a towel and was watching a TV cartoon channel.",1
